Executive_Name,Role,Type_of_Change,Effective_Date,Announcement_Date,Previous_Role_or_Replaced_Executive,Strategic_Context,Source_URL
Kochouseph Chittilappilly,Chairman Emeritus,Stepped Down,31-Mar-2025,28-Jan-2025,Was Chairman Emeritus & Founder,Stepped down at 75; wishes to focus on social and philanthropic activities,https://www.marketscreener.com/quote/stock/V-GUARD-INDUSTRIES-LIMITE-46730429/news/V-Guard-Industries-Limited-Announces-Step-Down-of-Kochouseph-Chittilappilly-as-Chairman-Emeritus-Ef-48888509/
Mithun K Chittilappilly,Managing Director,Re-appointment,01-Apr-2026 (5 years),May 2025,Continuing as MD,Re-appointed for further 5-year term,https://www.prysm.fi/news/v-guard-industries-seeks-shareholder-approval-for-director-re-appointments-via-postal-ballot
George Muthoot Jacob,Independent Director,Re-appointment (2nd term),05-Oct-2025,2025,Continuing as Independent Director,Re-appointed for second and final 5-year term,https://www.prysm.fi/news/v-guard-industries-seeks-shareholder-approval-for-director-re-appointments-via-postal-ballot
Manoj Panditrao Dalal,Business Head – Switches & Switchgears,Resignation,14-Sep-2025,Sep 2025,Was Business Head (Senior Managerial Personnel),Resigned from the services of the company,https://www.investywise.com/v-guard-industries-ltd-0cffca-2025/
Dr. Reena Philip,Additional Director (Non-Executive Non-Independent),New Appointment,28-Jan-2026,28-Jan-2026,New board position,Appointed for 4 years; subject to shareholder approval via postal ballot,https://www.prysm.fi/news/v-guard-industries-approves-q3-fy26-results-reappoints-independent-director-appoints-additional-director
