Rank,Indicator,Signal,Status,Time Period,Severity Level,Severity Rationale,Evidence (Verbatim),Source Document,Line Reference
1,Subsidiary Intelligence (Section 12D / Strategic Risks #1 / Section 6 Risk #6),"CT Australia: further impairment of full investment guided by management for March 31, 2026 — on top of ₹50.15 cr taken in FY25",Confirmed — management guidance,"FY25-26 (by March 31, 2026)",Critical,"A&M view: Active guidance of a pending write-down of remaining investment in a persistently loss-making subsidiary constitutes a balance-sheet event of the highest severity. Turnaround lens requires immediate accounting crystallisation and board-level escalation. The divestiture process failed (10 NDAs, no acceptable bid), trapping capital in a structurally impaired asset.","[IB-led divestiture process was] rolled back... Despite healthy buyer interest, no proposal met valuation expectations or broader strategic considerations... Process rolled back; The financial investment in Climate Holdings, Australia & its subsidiaries will be suitably treated in the book by the end of the current FY.","Corporate Presentation Feb 2026, p.52; Q3 FY26 Earnings Call Transcript, January 29, 2026","Lines 492–493; Line 561"
2,Financial Performance Trend (Section 13) / Strategic Risks #2,"FY25-26 revenue shock: standalone revenue down 30% YoY to ₹566 cr in 9M FY26; EBITDA down 57% to ₹81 cr; Q3 FY26 EBITDA margin 17.2%",Confirmed — audited quarterly results,"9M FY25-26 (April–December 2025)",Critical,"A&M view: A 30% revenue decline and 57% EBITDA collapse within a single fiscal year — even if weather-driven — signals extreme earnings volatility and structural overdependence on one seasonal category. Turnaround lens: working capital stress, fixed-cost deleverage, and covenant risk on a consolidated basis demand immediate attention.","9 months [FY26] top line is ₹80 crores versus ₹75 crores [GSK China cited as context]... standalone 9M revenue ₹566 cr vs ₹809 cr, EBITDA ₹81 cr vs ₹189 cr","Corporate Presentation Feb 2026 (p.47); Q3 FY26 Earnings Call Transcript, January 29, 2026","Lines 513; Lines 619–628"
3,Subsidiary Intelligence (Section 12D) / Strategic Risks #1,"CT Australia: 11+ consecutive quarters of operating losses; 9M FY26 EBITDA -₹8 cr, cash loss -₹15 cr; divestiture rolled back with no turnaround path articulated",Ongoing — no turnaround timeline given,"9M FY25-26 (cumulative 11+ quarters)",Critical,"A&M view: Chronic subsidiary losses sustained for 11+ quarters without a credible turnaround or exit plan represent a capital destruction event. Divestiture failure in January 2026 eliminates the primary exit option. The 50%+ overhead reduction has been executed but losses persist, signalling structural market/competitive impairment beyond cost fixes.","For Climate Holdings Australia 9 months [FY26] as a whole, the top line has been ₹128 crores versus ₹123 crores. At EBITDA level, it is minus ₹8 crores versus minus ₹14 crores. And at a PAT level, it is minus ₹18 crores versus minus ₹22 crores. And in terms of the cash loss, it is negative ₹15 crores versus negative ₹25 crores.","Q3 FY26 Earnings Call Transcript, January 29, 2026 (Nrupesh Shah)","Lines 489–490; Line 556"
4,Retail Footprint / Distribution (Indicator 11E) / Strategic Risks #3,"Pathways Retail: ₹58 cr bad debt (₹12 cr FY24 + ₹46 cr Q3 FY25); forensic fraud confirmed (record falsification, document forgery, fund diversion); only ₹8.5 cr recovered in 9M FY26",Post-event; partial recovery underway,"FY23-24 through 9M FY25-26",High,"A&M view: A ₹58 cr credit loss from a 13-year distributor relationship signals a systemic credit monitoring failure. Forensic findings of forgery and fund diversion indicate counterparty fraud was sustained over time — a governance red flag. Recovery at 15 cents on the rupee (₹8.5 cr of ₹58 cr) confirms near-total impairment.","We had carried out forensic check and came out with several irregularities, including falsification of the records as well as forgery of government documents etc., and also diversion of funds... Residual outstanding of ₹46 crores from Pathways has been provided for during the quarter as a doubtful debt... all in all ₹58 crores.","Q3 FY25 Earnings Call Transcript, February 5, 2025 (Nrupesh Shah / Achal Bakeri)","Lines 449–450; Line 558"
5,Industry Volume / Financial Performance (Indicators 1 / 13) / Strategic Risks #4,"Single product category seasonality: >74% of standalone revenue from summer-dependent household air coolers; RTY portfolio still only 26% of 9M FY26 revenue",Structural — ongoing,"9M FY25-26 / FY24-25",High,"A&M view: A business deriving >74% of revenue from a product category with a 90-day effective selling season carries extreme earnings volatility. The severity is evidenced by FY26 results: a subdued summer caused a 30% revenue collapse. RTY portfolio (26%) is insufficient to buffer against weather-driven downturns.","RTY portfolio (LSV + tower fans + kitchen cooling fans + water heaters + exports) = ~26% of 9M FY26 standalone revenue (up from <10% earlier)","Corporate Presentation Feb 2026; Q3 FY26 Earnings Call Transcript (Nrupesh Shah)","Lines 548; Line 559"
6,Financial Performance Trend — Consolidated vs Standalone (Section 13),"Consolidated EBITDA margin 9.5% in 9M FY26 vs standalone 14.4%; CT Australia subsidiary drag of ~490 bps on consolidated EBITDA margin; structural not cyclical",Confirmed — reported financials,"9M FY25-26",High,"A&M view: A 490 bps gap between standalone (14.4%) and consolidated (9.5%) EBITDA margin is a material structural drag. With CT Australia divestiture abandoned, this gap is now permanent until a new exit mechanism is found. Consolidated investors carry 4.9 ppt of margin penalty from a loss-making geography.","consolidated 9M FY26: revenue ₹793 cr, EBITDA ₹76 cr, EBITDA margin 9.5% vs standalone ₹566 cr, EBITDA ₹81 cr, EBITDA margin 14.4%","Corporate Presentation Feb 2026 (p.47); Q3 FY26 Earnings Call Transcript","Lines 513; Lines 527; Line 560"
7,Retail Footprint / Distribution (Indicator 11) / Operational,"Channel inventory overhang: record March 2025 trade stocking → elevated channel inventory suppressing FY26 primary demand recovery",Confirmed — management commentary,"FY25-26",High,"A&M view: Secondary demand weakness layered on top of weather weakness creates a multi-quarter channel destocking problem. Record stocking in March 2025 effectively pulled forward FY26 demand into FY25, making FY26 recovery slower than weather normalisation alone would suggest. Turnaround lens: distributor health check and sell-through monitoring required.","Revenue is lower on account of shortened and rain-disrupted summer... June '25 sales of ₹229 crores is the second-highest ever for a June quarter, surpassing the sales recorded in earlier summer quarters.","Q1 FY26 Earnings Call Transcript, August 1, 2025 (Nrupesh Shah)","Lines 49–50; Line 557"
8,Subsidiary Intelligence (Section 12C),"IMPCO Mexico: severe summer weakness in FY26; 9M FY26 revenue ₹101 cr vs ₹135 cr (-25%); EBITDA collapsed from ₹17 cr to ₹5 cr; PAT turned negative at -₹1 cr; cash profit ₹9 cr",Reported — unaudited quarterly,"9M FY25-26",High,"A&M view: IMPCO Mexico was a turnaround success (2021–2024), but its 9M FY26 performance (EBITDA -71% YoY) shows it inherits the same seasonal vulnerability as India standalone. With PAT turning negative and EBITDA at ₹5 cr, IMPCO is teetering. If US tariff environment deteriorates, IMPCO's strategic value rationale weakens further.","IMPCO Mexico for 9 months [FY26], it is ₹101 crores versus ₹135 crores. At EBITDA level, it is ₹5 crores versus ₹17 crores. And at a PAT level, it is minus ₹1 crore versus ₹10 crores, but at a cash profit level, it is positive ₹9 crores versus ₹12 crores.","Q3 FY26 Earnings Call Transcript, January 29, 2026 (Nrupesh Shah)","Lines 481–482"
9,Subsidiary Intelligence / Governance (Section 12D),"CT Australia divestiture rollback: IB-led process abandoned January 2026 after 10 NDAs with no acceptable bid; Symphony now trapped in a loss-making market with no near-term exit",Confirmed — management statement,"January 2026",High,"A&M view: A failed divestiture process — 10 NDAs signed, all bids rejected — signals either an unrealistic seller valuation expectation or structurally impaired asset economics that buyers cannot underwrite. The rollback eliminates the most plausible capital allocation fix for the CT problem. Symphony now owns a loss-making subsidiary with no clear path to exit.","[IB-led divestiture process was] rolled back... Despite healthy buyer interest, no proposal met valuation expectations or broader strategic considerations. Maintaining direct presence in Mexico and USA — Australia remains strategically important given shifting geopolitical conditions.","Corporate Presentation Feb 2026 (p.52)","Lines 492–493"
10,Cost Structure / A&P (Indicator 5C) / Strategic Risks #7,"Water heater A&P burn: >90% of ₹11 cr Q3 FY26 A&P spend allocated to water heaters; payback timeline and market share gain not disclosed; compressing off-season EBITDA margin",Ongoing — confirmed,"Q3 FY25-26",Medium,"A&M view: Allocating 90%+ of A&P budget to a nascent product category (water heaters) in the off-season creates a margin drag with undefined return. Without payback metrics, this represents a potential value-destructive brand investment in a highly competitive segment (Racold, A.O. Smith, Venus dominate) where Symphony enters late.","More than 90% of the advertisement and sales promotion expenses of ₹11 crores incurred during December '25 quarter pertains to water heater in addition to whatever we spent earlier.","Q3 FY26 Earnings Call Transcript, January 29, 2026 (Nrupesh Shah)","Lines 215–216; Line 562"
11,Gross Margin Strategy (Indicator 6D),"Q3 FY26 gross margin declined to 45.2% (vs 45.7% Q3 FY25 and 49.75% FY25 peak); 9M FY26 gross margin 48.3% — down 1.8 ppt YoY; seasonal mix and product category shift driving compression",Reported — quarterly financials,"Q3 FY25-26 / 9M FY25-26",Medium,"A&M view: Gross margin compression of 450+ bps from FY25 peak to Q3 FY26 — even if partially seasonal — signals pricing headroom or product mix erosion. Sustained below-50% gross margins constrain the operating leverage capacity and limit EBITDA recovery when volumes normalise. Turnaround lens: SKU-level GM analysis required.","Gross Margin (%): 45.2% [Dec'25] vs 45.7% [Dec'24]... Gross Margin: 273 [₹ Cr], 48.3% (▼1.8%) [9M FY26 vs 9M FY25]","Corporate Presentation Feb 2026 (p.46, p.47)","Lines 284–288"
12,Contract Manufacturing (Indicator 9) / Evidence Gap,"OEM vendor concentration: full OEM vendor list undisclosed; only EPACK Durables named; concentration risk and single-OEM dependency cannot be assessed",Evidence gap — structural,"FY24-25 / FY25-26",Medium,"A&M view: Symphony's 100% outsourced production model creates critical OEM dependency. Without visibility into OEM concentration (what % of volume from top 2 OEMs), single-source risk to production continuity, quality, and IP cannot be quantified. This is a supply chain governance gap in an asset-light model.","Products that we have designed and developed and the moulds of which are owned by Symphony, have been given for a few models to EPACK to produce on our behalf. We will not really just source a product which has not been developed by us.","Q3 FY25 Earnings Call Transcript, February 5, 2025 (Achal Bakeri)","Lines 362–363; Lines 571–572"
13,Retail Footprint / Governance (Indicator 11E),"Credit governance failure: Pathways Retail had 13-year relationship before fraud detected; Chairman acknowledged 'lapse in credit management judgment at operating level'",Post-event; remediated partially,"FY23-24 through Q3 FY24-25",Medium,"A&M view: A fraud undetected across a 13-year distributor relationship points to inadequate credit monitoring, receivables ageing review, and field-level audit processes. The Chairman's public acknowledgement of a governance lapse is material disclosure. Post-event credit insurance is remedial but does not address root-cause credit culture failure.","We do not give credit as a principle to general trade. It is only to modern retail and the regional chain stores or to this e-commerce distributor that we have been giving credit. In the general trade, which still constitutes the vast majority of our sales, we have an absolute zero credit policy.","Q3 FY25 Earnings Call Transcript, February 5, 2025 (Achal Bakeri)","Lines 424–426; Lines 447–453"
14,Subsidiary Intelligence (Section 12B),"GSK China: EBITDA declining in 9M FY26 (₹8 cr vs ₹14 cr, -43% YoY); inter-company loan of ₹26 cr outstanding from Symphony to GSK; FY26 EBITDA trajectory unclear",Reported — unaudited,"9M FY25-26",Medium,"A&M view: GSK China's EBITDA declining 43% YoY in 9M FY26 despite stable revenue (₹80 cr vs ₹75 cr) suggests cost inflation or product mix erosion. The ₹26 cr inter-company loan adds related-party exposure. A turnaround that reverses is a yellow flag — turnaround sustainability must be stress-tested.","9 months [FY26] top line is ₹80 crores versus ₹75 crores. At EBITDA level, it is ₹8 crores versus ₹14 crores.","Q3 FY26 Earnings Call Transcript, January 29, 2026 (Nrupesh Shah)","Lines 476–477"
15,After-Sales Service (Indicator 10) / Evidence Gap,"After-sales service costs not separately disclosed; embedded in 'Other Expenses' (₹136 cr, 11.5% of revenue FY25); no warranty provision quantum available for standalone India",Evidence gap — structural,"FY24-25",Medium,"A&M view: In a consumer durables business, after-sales cost opacity limits assessment of product quality trends, warranty reserve adequacy, and field failure rates. Without a separate service cost line or warranty provision, there is no forward-looking liability visibility — a turnaround concern if product quality deteriorates post-scale-up.","After-sales service costs are not separately disclosed as a P&L line item. They are embedded within 'Other Expenses' (₹136 crore in FY25, 11.5% of revenue). No explicit warranty provision quantum is disclosed standalone.","Integrated Annual Report FY2024-25 (BRSR, p.128); Evidence Gap disclosed in report","Lines 399–401; Line 570"
16,Retail Footprint / Distribution (Indicator 11) / Evidence Gap,"Channel revenue split (GT vs MT vs e-commerce vs D2C) not disclosed; management states GT is 'vast majority' but no quantification; limits channel profitability and credit risk assessment",Evidence gap — competitive sensitivity,"FY24-25 / FY25-26",Medium,"A&M view: Without channel-wise revenue disaggregation, it is impossible to quantify the share of revenue exposed to credit risk (MT + e-com = credit-bearing channels). Post-Pathways, credit insurance mitigates downside, but the size of the credit-exposed book remains opaque.","We do not give credit as a principle to general trade... In the general trade, which still constitutes the vast majority of our sales, we have an absolute zero credit policy.","Q3 FY25 Earnings Call Transcript, February 5, 2025 (Achal Bakeri); Evidence Gap","Lines 424–426; Line 577"
17,Subsidiary Intelligence — Brazil,"Brazil subsidiary: ₹39 cr revenue (FY25, +50% YoY), PAT -₹3 cr; forex drag; trading subsidiary with no manufacturing; small scale limits strategic optionality",Reported — audited FY25,"FY24-25",Low,"A&M view: Brazil is a small-scale trading loss maker. At ₹39 cr revenue and -₹3 cr PAT, it does not move the needle on group P&L but represents recurring overhead drag. No turnaround evidence; managed as a market-access vehicle. Risk is limited by small absolute size.","Symphony Climatizadores Ltda [Brazil]: Revenue ₹39 cr (+50%), EBITDA Neg (forex), PAT -₹3 cr; Trading subsidiary","Q4 FY25 Earnings Call Transcript, May 8, 2025; Section 12A subsidiary table","Lines 468; Lines 739–744"
18,Distribution / Export (Indicator 11),"Egypt export market blocked; Sri Lanka back; Middle East/Africa/Europe growing but Egypt was a meaningful individual market",Ongoing — regulatory/geopolitical,"FY24-25 / FY25-26",Low,"A&M view: Loss of a single export market (Egypt) in a ₹117 cr export portfolio is a moderate risk — diversifiable but signals geopolitical fragility in developing-market export revenues. Low severity given ongoing growth in Middle East, Africa, Europe, and new US traction.","Export is ₹117 crores [FY25 standalone]... Sri Lanka back; Egypt blocked; Middle East, Africa, Europe growing","Q4 FY25 Earnings Call Transcript; Corporate Presentation Feb 2026","Lines 327–328; Lines 573–574"
19,Industry Volume / Competition (Indicator 1),"Unorganised segment competition: 65% of Indian air cooler market is unorganised metal coolers; persistent price competition from regional/unbranded players targeting value-conscious consumers",Structural — ongoing,"Structural",Low,"A&M view: The unorganised segment is a long-term structural risk to ASP and margin if Symphony's price-warrior 'Air Force' range fails to accelerate migration. However, BSI norm tailwinds and income growth structurally favour Symphony. Low severity given management's deliberate 'dressing room' strategy.","A bigger chunk of the growth is coming from the movement of consumers from the unorganised to the organized segment. And as I said, the entire metal cooler market is mostly unorganised.","Q3 FY26 Earnings Call Transcript, January 29, 2026 (Nrupesh Shah)","Lines 37–38"
20,Pricing Strategy (Indicator 4),"Air Force / Bharat Range: price-warrior positioning targeting rural/unorganised segment at lower price points risks diluting blended ASP and gross margin if mix shifts materially toward entry-level SKUs",Managed — early stage,"FY24-25 / FY25-26",Low,"A&M view: Deliberate price-warrior launch (Air Force targeting 65% unorganised market) could dilute blended ASP and gross margins if penetration accelerates faster than premium mix growth. Currently a managed risk — dual-brand positioning limits dilution — but bears monitoring as Bharat Range scales.","Air Force emerged as a technology-driven gamechanger that addressed the price, value, and aspiration needs of a consumer who conventionally focused only on the unorganised variant.","Integrated Annual Report FY2024-25 (p.32)","Lines 154–155"
21,Subsidiary Intelligence / Governance (Evidence Gap),"IMPCO Mexico and CT Australia divestiture valuation undisclosed: no valuation floor, replacement cost, or strategic value assessment available; NDA constraints prevent disclosure",Evidence gap — NDA-constrained,"FY25-26",Low,"A&M view: Turnaround advisory requires knowing the floor value and strategic worth of assets being retained or divested. With no valuation disclosed (10 NDAs signed), the capital at risk in IMPCO + CT is opaque. Divestiture failure may reflect overvaluation; retained assets may be worth less than book.","IMPCO/CT replacement cost/strategic value: No divestiture valuation disclosed due to NDA constraints","Section 15 Evidence Gaps table","Lines 576–577"
22,Capital Efficiency / Contract Manufacturing (Indicator 9),"STRENGTH: Infinite ROCE — core India standalone capital employed = -₹32 cr (monthly avg FY25); ROCE theoretically infinite; treasury ₹460 cr growing; debt-free",Confirmed — audited,"FY24-25",Informational,"A&M view: Negative capital employed in the core India business is a structural competitive advantage of the highest order. The business self-funds growth, returns 84% of consolidated PAT to shareholders, and builds treasury simultaneously. This capital efficiency profile is rare in Indian consumer durables.","Capital Employed in Core Business (Monthly Avg.): (-32) [FY25] vs 44 [FY24]; ROCE: Infinite [FY25] vs 362% [FY24]","Q2 FY25 Earnings Call Transcript, October 29, 2024; Q4 FY25 Presentation","Lines 373–376; Line 551"
23,Market Share (Indicator 8),"STRENGTH: Domestic air cooler revenue ₹1,065 cr (FY25) > combined revenue of next 3–4 players; No. 2 player ~₹250 cr; 2 of 3 Google air cooler searches are for Symphony",Confirmed — GfK 2025; Google Analytics,"FY24-25 / Jul 2024–Jun 2025",Informational,"A&M view: Market leadership of this magnitude (4x the No. 2 player; top 3-4 combined < Symphony) provides durable pricing power, channel leverage, and OEM scale advantages. Brand preference dominance (Google search 2/3) confirms consumer pull strength that sustains through weather disruptions.","The second most company's turnover is around ₹250 crores. And top 3 to 4 players put together combined household, domestic air cooler sale is less than Symphony sales.","Q3 FY26 Earnings Call Transcript, January 29, 2026 (Nrupesh Shah)","Lines 321–322"
24,Distribution / RTY Portfolio (Indicator 11 / Section 14),"STRENGTH: RTY portfolio (LSV + tower fans + kitchen cooling fans + water heaters + exports from India) now 26% of 9M FY26 standalone revenue; growing at 50%+ CAGR over 3–4 years",Confirmed — management commentary,"9M FY25-26",Informational,"A&M view: RTY portfolio growing from <10% to 26% of revenue in 3–4 years demonstrates successful category diversification. If RTY reaches 40%+ of revenue, the seasonal weather risk diminishes materially. This is the most important structural de-risking initiative underway.","RTY portfolio (LSV + tower fans + kitchen cooling fans + water heaters + exports) = ~26% of 9M FY26 standalone revenue (up from <10% earlier); growing at 50%+ CAGR","Corporate Presentation Feb 2026; Q3 FY26 Earnings Call Transcript","Lines 548; Lines 755–760"
25,Industry / Export (Section 12E / Section 14),"STRENGTH: US export opportunity — no US tariff on India-origin air coolers; no tariff on Mexico-to-US air coolers; large US retailers actively making inquiries; prior US peak sales $23 mn to rebuild",Opportunity — early stage,"FY25-26",Informational,"A&M view: A tariff-free corridor to the world's largest consumer market, at a time when Chinese competitors face 145%+ US tariffs, represents a structural export opportunity. Symphony's India + Mexico manufacturing bases are uniquely positioned. If US traction converts to orders, it could add material revenue with high margins.","As far as air coolers are concerned, there is no tariff... And even between Mexico and United States, as far as air cooler is concerned, there is no tariff, and there seems to be a very strong traction, especially from both the markets.","Q3 FY26 Earnings Call Transcript, January 29, 2026 (Nrupesh Shah)","Lines 497–498; Line 549"
26,Pricing Strategy / Brand (Indicator 4 / Indicator 8),"STRENGTH: 10–15% price premium vs national competitors; 4.8/5 rating from 34,000+ reviews; most preferred brand (Kantar 2025); 2/3 Google air cooler searches for Symphony",Confirmed — GfK 2025; Kantar 2025; Google Analytics,"FY24-25 / FY25-26",Informational,"A&M view: Brand pricing power of 10–15% premium with no evidence of erosion, combined with dominant search intent ownership (2 of 3 searches), indicates a structurally defensible moat. Brand investment of ₹449 cr over 10 years has built durable consumer preference.","Premium: Despite commanding a 10–15% premium over national [competitors]... In 95–120L category, Symphony commands ~10% premium over #2 competitor (Source: GfK Market Health Study)","Integrated Annual Report FY2024-25 (p.31); Corporate Presentation Feb 2026 (p.18)","Lines 134–135; Lines 137–138"
27,Retail Footprint / Governance (Indicator 11E),"STRENGTH / MITIGANT: Credit insurance implemented for all modern trade post-Pathways fraud; first-ever credit insurance policy; structural credit risk mitigation for credit-bearing channels",Confirmed — management statement,"Post-Q3 FY24-25",Informational,"A&M view: Credit insurance for modern trade is an appropriate structural fix to the Pathways failure. It converts counterparty credit risk to insurable risk, capping future single-distributor loss severity. While reactive, the remediation is proportionate and reduces tail risk for credit-bearing channel exposure.","Now for entire modern trade, credit insurance has been taken. So for the first time, this credit insurance policy has been taken.","Q3 FY25 Earnings Call Transcript, February 5, 2025 (Nrupesh Shah)","Lines 452–453"
28,Subsidiary Intelligence (Section 12B),"STRENGTH: GSK China turnaround complete — FY25 revenue ₹100 cr (+126% YoY); EBITDA ₹20 cr (+337%); PAT ₹15 cr; now supplying IMPCO Mexico and CT Australia via intersubsidiary synergy",Confirmed — audited FY25,"FY24-25",Informational,"A&M view: GSK China represents a completed turnaround within the Symphony group — from loss-maker to ₹20 cr EBITDA contributor. The intersubsidiary supply chain (GSK China supplying IMPCO Mexico) demonstrates operational synergy extraction. A positive structural data point partially offsetting CT Australia losses.","For GSK China, the revenue from operations for FY'25 is ₹100 crores, up by 126%, while EBITDA is ₹20 crores, up by 337% and PAT is ₹15 crores.","Q4 FY25 Earnings Call Transcript, May 8, 2025 (Nrupesh Shah)","Lines 473–474"
