Rank,Indicator,Signal,Status,Time Period,Severity Level,Severity Rationale (1-2 lines turnaround lens),Source Document,Line Reference
1,Parent Divestiture Risk,"Whirlpool Corp: 51% → ~20% by mid-to-late 2025; BLA/TLA not finalized",CRITICAL RISK,"Announced Jan 30, 2025; Mauritius entity sold 24% Feb 2024 — sequential",Critical,"Existential structural risk: brand, IP, technology pipeline, BIS compliance roadmaps, and engineering support all rest on an unfinalized licensing arrangement. Every other pain point exists in its shadow; this is the singular event creating the engagement window.",AR 2024-25,"Lines 795, 913-935, 1296-1298"
2,Gross / Operating Margin,"OPM 3.86% (FY25) vs 1.99% (FY24) vs 2.21% (FY23)",Recovering,"FY 2022-23 through FY 2024-25",Critical,"Near-zero margin of safety: freight alone exceeds OPM at 6.3% of revenue. Any simultaneous cost shock — commodity, freight, or pricing — eliminates operating profit entirely. Recovery is leverage-dependent and fragile.","AR 2024-25; AR 2023-24","AR 2024-25: Line 651; AR 2023-24: Line 1777"
3,E-Waste Regulatory Cost,"INR 8,057 lacs; +84% YoY; ""additional price upcharge Rs. 41 Cr""",Critical,"FY 2024-25 vs FY 2023-24",High,"Non-discretionary EPR obligation that scales automatically with revenue — growing the business accelerates the cost. No containment strategy, recycler optimization, or cost pass-through mechanism disclosed. Consumed INR 3,680 lacs of gross margin improvement in one year.",AR 2024-25,"Lines 707, 25519, 27244"
4,Traded Goods Purchases,"INR 73,486 lacs — +74% YoY; unexplained",Watch / High Risk,"FY 2022-23 through FY 2024-25",High,"74% surge in outsourced finished goods with zero management explanation in any disclosure — governance opacity. Could signal capacity breach, unmanaged category expansion, or unplanned asset-light shift; each has distinct margin implications. At 9.9% of revenue vs 6.7% prior year.",AR 2024-25,Line 18088
5,Freight & Logistics Cost,"INR 46,879 lacs (6.3% of revenue); +14.9% YoY",Negative,"FY 2022-23 through FY 2024-25",High,"Single largest line in Other Expenses, growing faster than revenue despite 17% top-line growth — no operating leverage achieved. Three geographically dispersed plants with no disclosed logistics optimization initiative. 100 bps reduction = ~INR 742 lacs direct margin.",AR 2024-25,"Note 27 (~Line 25519)"
6,Transfer Pricing Litigation,"Pending disputes AY 2004-05 to 2022-23; INR 10,568 lacs+ exposure",High Risk,"Multi-year; ongoing as of Mar 31, 2025",High,"Nearly two decades of unresolved litigation with growing contingent exposure. Parent sell-down intensifies scrutiny: tax authorities will scrutinize related-party payments (royalty + tech know-how INR 10,258 lacs) as ownership changes. TP disputes frequently block ownership transitions.",AR 2024-25,"Lines 27023-27109"
7,Pricing Strategy (H1 FY24),"Price corrections in H1 to restore competitiveness",Negative,H1 FY 2023-24,High,"On-the-record pricing governance failure: revenue -3.6% and profit -16.7% while industry grew high-single-digits. Demonstrates reactive posture — no structured pricing architecture. At 3.86% OPM, each pricing episode costs 200-300 bps of margin.",AR 2023-24,"Lines 1460-1475"
8,Industry vs Company Growth,"Industry high-single-digits; company consolidated +3% — underperformed",Negative,FY 2023-24,High,"Structural execution failure: company lost market position while industry expanded. Recovery in H2 FY24 was management-driven and reactive. Underlying commercial capability gap exposed — risk of recurrence in next soft-demand or pricing-pressure cycle.",AR 2023-24,Line 1065
9,Channel Architecture,"99.33% dealer; 3,983 dealers; top-10 = 26.99%",Watch,FY 2024-25,High,"Complete intermediary dependency: zero direct consumer revenue channel despite D2C named as strategic imperative. Dependency increased YoY (99.15% → 99.33%). Top-10 concentration creates dealer negotiating leverage. No direct consumer data at scale.",AR 2024-25,"Lines 9478-9493"
10,After-Sales Service Cost,"INR 13,449 (FY25) / 11,720 (FY24) / 8,359 (FY23) — +60% in 2 yrs",Negative,"FY 2022-23 through FY 2024-25",Medium,"Service cost growing 2x faster than revenue with zero KPI accountability — no center count, resolution rates, or cost-per-call benchmarks disclosed. Cannot distinguish network investment from quality failure or operational inefficiency. INR 13,449 lacs cost line is unauditable.",AR 2024-25,"Note 27; Lines 1078-1107"
11,Employee Cost,"INR 80,789 lacs (10.9% of revenue); +19.2% YoY",Watch,"FY 2024-25 vs FY 2023-24",Medium,"Employee cost outpacing revenue growth (19.2% vs 17.2%): operating leverage absent. Salaries/wages +21.9% YoY suggests headcount expansion beyond salary inflation. 8,922 other-than-permanent employees create structural cost opacity. Worsening three-year trend.",AR 2024-25,"Lines 25360-25390"
12,Commodity Risk,"No forward contracts for copper hedging",Watch,"FY 2024-25 and FY 2023-24 — consistent",Medium,"Full copper price pass-through to cost of production at 3.86% OPM — any unhedged commodity spike directly eliminates operating profit. Structural risk management gap persisting across multiple reporting periods with no disclosed change in posture.",AR 2024-25,"Lines 29149-29152"
13,Elica Subsidiary Performance,"Revenue flat; PBT margin 15.7%; PAT INR 5,884 lacs; stake 96.81%",Mixed,"FY 2024-25 vs FY 2023-24",Medium,"Revenue flat despite single-digit volume growth implies ASP erosion. Capital deployed to acquire 9.56% additional stake in a business that then stalled at the top line. Highest-margin business in portfolio (15.7% PBT vs 6.1% consolidated) is a missed growth opportunity.",AR 2024-25,"Lines 43841-43859, 588-591"
14,Advertising & Promotions,"INR 7,169 lacs; +62% YoY",Watch,"FY 2024-25 vs FY 2023-24",Medium,"62% advertising increase coincides with market share gains — cannot determine whether gains are structural or spend-supported. At thin margins, spend-driven share is reversible. If revenue decelerates, advertising-to-revenue ratio deteriorates sharply.",AR 2024-25,"Lines 25597-25601"
15,Parent IP Cost Dependency,"INR 10,258 lacs to parent (~1.4% of revenue)",Neutral / Risk,FY 2024-25,Medium,"Post sell-down BLA/TLA renegotiation could escalate royalty and tech know-how costs by 50-100 bps of margin compression. Current terms stable but future trajectory under renegotiated licensing structure is unknown — represents a latent, unquantified cost escalation risk.",AR 2024-25,"Lines 25603, 28134"
16,Operational Intelligence,"Headwinds: freight, BIS changes, slow inventory, demand fluctuations",Watch,FY 2024-25,Medium,"Multiple concurrent operational headwinds disclosed — each individually manageable but collectively compressive on a 3.86% OPM business. BIS and freight headwinds both recurring; inventory write-off quantum from BIS changes not disclosed.",AR 2024-25,"Lines 885-891"
17,Operational Intelligence,"Energy norm transition — biggest since inception; impacted margins",Negative,FY 2023-24,Medium,"Largest single regulatory disruption in company history impacted margins significantly in FY24. Pattern is recurring — each major energy norm cycle creates inventory write-offs and production transitions. Risk compounded during parent sell-down when BIS compliance support could weaken.",AR 2023-24,"Lines 1048-1060"
18,Capacity / Plant Utilization,"Pune: WCM Silver; Faridabad & Puducherry: Bronze",Positive (partial),FY 2024-25,Medium,"After multi-year WCM investment, no plant has reached Gold or Platinum — the genuine world-class benchmark. WCM maturity directly constrains P4G cost savings pace. Competitors at higher WCM maturity levels have superior cost structures.",AR 2024-25,"Lines 899-957"
19,Localization Strategy,"CIF Imports INR 1,24,638 lacs (FY25) vs INR 1,10,423 lacs (FY24)",Neutral,"FY 2024-25 vs FY 2023-24",Medium,"Import bill large in absolute terms and growing. Component-level localization % by category undisclosed. Growing 13% vs revenue growth 17% — mild relative improvement but insufficient to materially reduce FX and supply chain exposure. Dual sourcing deployed but scope not disclosed.","AR 2024-25; AR 2023-24","AR 2024-25: Line 7349; AR 2023-24: Line 8828"
20,Localization Strategy,"Ministry of Steel approval delays caused supply disruption",Watch,FY 2024-25,Medium,"Government-process dependency creates periodic supply chain disruption in steel sourcing. Not a structural failure but a recurring fragility. Could intensify if policy changes or approval timelines lengthen — particularly vulnerable during a period of ownership transition.",AR 2024-25,"Lines 9201-9202"
21,Localization Strategy,"Exports ~4% of turnover vs ""Make-in-India for the world"" aspiration",Watch,FY 2024-25,Medium,"Strategic aspiration not backed by export infrastructure or momentum. 4% export ratio signals no manufacturing competitiveness for global markets. No export growth initiative, target markets, or timeline disclosed. Long-term capability gap; low immediate priority until domestic margins stabilize.",AR 2024-25,"Lines 7347-7349"
22,Pricing Strategy,"Tactical pricing adjustments to stay competitive; premiumization push",Neutral,FY 2024-25,Low,"Reactive pricing posture continues in FY25. No structural pricing governance framework evident. Risk of recurrence of FY24 pricing episode persists, though severity is lower as company grew 16% YoY in FY25.",AR 2024-25,"Lines 344, 572"
23,Capacity / Plant Utilization,"Specific utilization %: NOT FOUND",NOT FOUND,—,Low,"Data gap: cannot assess whether 74% traded goods surge reflects capacity constraint or strategic choice. Fundamental operational diagnostic is missing — no plant-level utilization data in either Annual Report. A&M capacity audit is a clear entry point.",AR 2024-25,Not Found
24,Market Share,"Exact market share %: NOT FOUND",NOT FOUND,—,Low,"Data gap: cannot assess durability of share gains or whether they are structural vs spend-driven. Management references 'substantial gains' only qualitatively. Without % data, competitive moat cannot be evaluated.",AR 2024-25,Not Found
25,Contract Manufacturing,"Contract manufacturing — explicit strategy: NOT FOUND",NOT FOUND,—,Low,"Data gap: combined with unexplained 74% traded goods surge, creates sourcing opacity fundamental to cost structure analysis. Cannot distinguish strategic intent from operational necessity. Critical missing input for make-vs-buy diagnostic.",AR 2024-25,Not Found
26,After-Sales Service Network,"Number of service centers: NOT FOUND",NOT FOUND,—,Low,"Data gap: INR 13,449 lacs service cost line is unverifiable for efficiency without network scale data. Cannot benchmark cost-per-service-center or cost-per-technician. Service cost accountability is structurally absent.",AR 2024-25,Not Found
27,Operational Intelligence,"Three plants — Faridabad, Pune, Puducherry",Neutral,FY 2024-25,Low,"Structural root cause of 6.3% freight-to-revenue ratio: three plants across three regions with pan-India distribution. Not an immediate risk but a structural constraint on logistics efficiency improvement. No rationalization initiative disclosed.",AR 2024-25,"Lines 117-135"
28,D2C Strategic Intent,"Grow consumer direct business ahead of the industry",Positive (Intent only),FY 2024-25,Low,"Strategic aspiration vs execution gap: D2C stated as imperative but zero direct channel infrastructure disclosed. Dealer dependency moved in the wrong direction in FY25 (99.15% → 99.33%). No timeline, investment plan, or D2C capability roadmap disclosed.",AR 2024-25,"Lines 773-775"
29,Workforce,"10,505 employees + 4,749 workers; permanent: 2,193",Neutral,FY 2024-25,Low,"High proportion of non-permanent and contract workforce creates cost opacity. Cannot disaggregate employee cost growth (+19.2%) between headcount expansion and salary inflation. Labor cost base is analytically opaque without category-level headcount trends.",AR 2024-25,"Lines 7712-7808"
30,Industry vs Company Growth,"Industry: mid-single-digit volume growth (refrigerators & WM)",Context,FY 2024-25,Informational,"Demand environment context: industry growing supports WIL's recovery. 'New and expanding manufacturers' cited signal intensifying competitive pressure on pricing. Provides baseline for performance assessment only.",AR 2024-25,"Lines 146-154"
31,Industry vs Company Growth,"Consolidated revenue grew 16% YoY; double-digit all 4 quarters",Positive,FY 2024-25,Informational,"Strong revenue growth sustaining operating leverage. Outpaced industry mid-single-digit growth. Sustained across all four quarters. Positive but not de-risking structural cost vulnerabilities.",AR 2024-25,"Lines 558-565"
32,Industry vs Company Growth,"H2 FY24 consolidated revenue +9.9% — recovery",Improving,H2 FY 2023-24,Informational,"Management self-corrected H1 FY24 decline through reactive pricing and commercial action. Demonstrates operational responsiveness. Does not address the structural pricing governance gap that caused the decline.",AR 2023-24,"Lines 472, 493, 1715"
33,Raw Material Cost,"Material costs reduced 1% despite regulatory cost increases",Positive,FY 2024-25,Informational,"P4G delivering measurable cost productivity. However, P4G savings are being partially offset by E-waste and freight escalation. Program alone cannot close the structural margin gap.",AR 2024-25,"Lines 710-714"
34,Raw Material Cost,"56.8% of revenue; down 270 bps YoY via P4G",Positive,"FY 2024-25 vs FY 2023-24",Informational,"Material cost improvement is the primary gross margin driver. Risk: gains are partly revenue-leverage-dependent — deceleration in top-line growth would automatically worsen the ratio even with flat absolute costs.",AR 2024-25,"Lines 18094, 25197"
35,Operational Intelligence,"AI-driven retail exec hiring; re-engineered rewards",Positive (Intent),FY 2024-25,Informational,"Commercial capability building signal. Investment intent in field force quality. However, headcount, productivity metrics, and ROI are undisclosed — cannot validate effectiveness from disclosures.",AR 2024-25,"Lines 385-391"
36,Operational Intelligence,"INR 7,914 lacs (1.1%); doubled from INR 3,581 lacs (0.6%)",Positive,"FY 2024-25 vs FY 2023-24",Informational,"R&D doubling is a positive capability investment — critical in context of parent sell-down where technology access may be restricted post-transition. Building internal innovation capacity reduces long-term parent dependency.",AR 2024-25,"Lines 7333-7335"
37,Gross / Operating Margin,"Consolidated PAT Margin 4.6% (FY25) vs 3.3% (FY24); PAT +62% YoY",Positive,"FY 2024-25 vs FY 2023-24",Informational,"PAT recovery confirms operating leverage and P4G are delivering bottom-line results. However, 4.6% consolidated PAT margin remains thin by consumer durables standards and provides minimal buffer for investment or cost shocks.",AR 2024-25,"Lines 697-710"
38,Market Share,"Growing market shares substantially in refrigerators and laundry",Positive,FY 2024-25,Informational,"Market share gains across all four quarters — sustained commercial momentum. Coincides with 62% advertising increase — structural vs spend-driven gains cannot be distinguished from disclosures alone.",AR 2024-25,"Lines 394-395"
39,Market Share,"Substantially increased vs year ago — H2 FY24",Positive,H2 FY 2023-24,Informational,"Share recovery after H1 FY24 loss demonstrates commercial resilience and management responsiveness. Does not resolve the underlying pricing governance weakness.",AR 2023-24,Line 1454
40,Localization Strategy,"Targeted localization — no material FX exposure; dual sourcing",Positive,FY 2024-25,Informational,"Effective FX risk management through localization and dual sourcing. Import intensity declining relative to revenue. Positive operational signal; however absolute import bill remains large at INR 1.25 lakh crore.",AR 2024-25,"Lines 5427-5429, 1022"
41,Gross / Operating Margin,"Gross margin improved ~140 bps (~31.9% → ~33.3%)",Positive,"FY 2024-25 vs FY 2023-24",Informational,"Meaningful gross margin recovery driven by P4G and revenue leverage. E-waste cost consumed INR 3,680 lacs of the improvement. Gains are partly structural (P4G) and partly cyclical (leverage) — cyclical portion is fragile.",AR 2024-25,Standalone P&L
42,Retail Footprint,"3,983 dealers (+161 YoY); top-10 declining to 26.99%",Positive,"FY 2024-25 vs FY 2023-24",Informational,"Expanding dealer network with modest deconcentration of top-10 share. Positive coverage signal. However, dealer network growth deepens the intermediary dependency that D2C strategy is intended to reduce — directionally inconsistent.",AR 2024-25,"Lines 9486-9493"
43,Workforce,"Employee attrition declining: FY23: 18% → FY24: 16% → FY25: 16%",Positive,"FY 2022-23 through FY 2024-25",Informational,"Positive workforce stability trend supporting WCM and P4G capability programs. Attrition at 16% remains material but declining direction is encouraging. Stability needed for sustained manufacturing quality improvement.",AR 2024-25,"Lines 7952-7984"
